anime_id,Name,English name,Other name,Score,Genres,Synopsis,Type,Episodes,Aired,Status,Producers,Licensors,Studios,Source,Duration,Rating,Rank,Popularity,Favorites,Image URL
103,Fushigi Yuugi,Mysterious Play,ふしぎ遊戯,7.61,"Adventure, Fantasy, Romance","During a visit to the National Library, Miaka Yuuki and Yui Hongo stumble upon a strange old book that casts a red light, sucking them inside its unfamiliar world. Upon arrival, the two encounter hostile slave traders and barely escape with the help of Tamahome—a powerful young man bearing a Chinese symbol on his forehead. But, a moment later, the red light returns and takes Yui away.

Desperate to reunite with her companion, Miaka asks Tamahome for assistance. However, the situation escalates when the pair encounters the land's emperor, Hotohori, who believes Miaka is the foretold priestess of the kingdom's protector god Suzaku. By gathering the god's seven Celestial Warriors, the priestess can summon Suzaku and have all her wishes granted. Hotohori hopes this will save his country, and since it appears to be a fitting solution to the girl's problems as well, he convinces her to accept the role.

Meanwhile, at the library, Yui realizes she has been brought back alone. Unable to intervene, she helplessly witnesses Miaka traversing through courageous trials as the mysterious book's heroine.",TV,52,"Apr 6, 1995 to Mar 28, 1996",Finished Airing,"TV Tokyo, Shogakukan-Shueisha Productions, Yomiko Advertising, Apollon","Media Blasters, Geneon Entertainment USA",Pierrot,Manga,23 min per ep,PG-13 - Teens 13 or older,1357,1748,2043,https://cdn.myanimelist.net/images/anime/2/20140.jpg
104,Fushigi Yuugi: Eikouden,Mysterious Play: Eikoden,ふしぎ遊戯 -永光伝,6.82,"Adventure, Drama, Fantasy, Romance","After years of hardships interfered with their love, Miaka Yuuki and Taka Sukunami are finally married and expecting a baby—the pinnacle of their unbreakable bond. Unfortunately, not everyone rejoices alongside the blessed couple. Mayo Sakaki, one of Taka's students, has a crush on him and cannot bear witnessing the pair's flourishing relationship.

Upon discovering The Universe of the Four Gods, Mayo learns that the old book is where Miaka and Taka first met as the priestess of the god Suzaku and the god's Celestial Warrior Tamahome. Unscrupulous about destroying a happy family, Mayo readily ventures inside with hopes of becoming the new priestess of Suzaku and rewriting the story to her advantage.

Meanwhile, her actions do not delay to show devastating effects. Leaving an unconscious Miaka at the hospital, Taka must follow Mayo to The Universe of the Four Gods and stop her before the circumstances worsen for his wife and their unborn child.",OVA,4,"Dec 21, 2001 to Jun 25, 2002",Finished Airing,UNKNOWN,"Media Blasters, Geneon Entertainment USA",Pierrot,Manga,30 min per ep,PG-13 - Teens 13 or older,4776,4833,40,https://cdn.myanimelist.net/images/anime/11/67701.jpg
105,Futakoi,Twin Love,双恋,6.44,"Comedy, Romance","With his mother dead and his father working abroad, Futami Nozomu returns to the town where he lived as a child, to attend high school and work part-time at a local shrine. He soon finds himself caught up in a local legend of twin girls loving the same man. And there are many twin girls in this town....

(Source: ANN)",TV,13,"Oct 6, 2004 to Dec 29, 2004",Finished Airing,Lantis,UNKNOWN,Telecom Animation Film,Original,24 min per ep,PG-13 - Teens 13 or older,6666,3540,23,https://cdn.myanimelist.net/images/anime/1/125.jpg
106,Futakoi Alternative,UNKNOWN,フタコイ オルタナティブ,6.86,"Comedy, Drama, Romance","The Futaba Detective Agency, being run by Rentarou, who has taken over the family business, after his father's death 3 weeks ago. Along w/ Sara &amp; Souju, his live-in identical twin assistants. He ends up running afoul of the local Yakuza.

(Source: ANN)",TV,13,"Apr 7, 2005 to Jun 30, 2005",Finished Airing,Lantis,UNKNOWN,"ufotable, feel., Studio Flag",Original,24 min per ep,PG-13 - Teens 13 or older,4571,3750,78,https://cdn.myanimelist.net/images/anime/6/16733.jpg
107,Gate Keepers,UNKNOWN,ゲートキーパーズ,6.92,"Action, Comedy, Fantasy, Sci-Fi","Technology, science, and industry—this is 1969 Tokyo, and there is no better time to be alive! But a shadow looms quietly around every corner: ""Invaders"" have infiltrated the populace, and nobody knows who or what they are.

Only the members of the top-secret agency AEGIS know of their existence. Covertly fighting the enemy is their job, but only those with the ability to open ""Gates"" to another world can truly defeat them. Within AEGIS is a specialized task force known as the ""Gate Keepers."" Composed of extraordinary individuals with a variety of Gate-related abilities, they are the only ones who can save humanity from the vicious Invaders plaguing the planet.

Shun Ukiya is an average high school student who lives with his widowed mother and little sister. While on his way home from school one day, he comes across a group of Invaders heading toward his house. In a desperate plight to save his family, Shun discovers he possesses the ability to open a Gate, allowing him to harness massive amounts of energy. With his newfound ability exposed, he catches the attention of AEGIS, and particularly the interest of one of its Gate Keepers, Shun's childhood friend Ruriko Ikusawa.",TV,24,"Apr 3, 2000 to Sep 18, 2000",Finished Airing,Media Factory,Geneon Entertainment USA,Gonzo,Game,25 min per ep,PG-13 - Teens 13 or older,4314,4404,54,https://cdn.myanimelist.net/images/anime/12/15226.jpg
108,Gate Keepers 21,UNKNOWN,ゲートキーパーズ21,6.74,"Action, Drama, Sci-Fi","Thirty-two years have passed since the initial defeat of the Invaders. A.E.G.I.S is all but dismantled now and has become an underground organization consisting of only a few Gate Keepers left to save humanity. One of the members, Ayane Isuzu, is sick of society as a whole, though she continues to defeat the Invaders out of spite for her father. Suddenly, she learns of the revival of Machine General (Kikai Shogun) and Devil Count (Akuma Hakushaku), but a mysterious ghost girl now accompanies them. It is up to Ayane and the remnants of A.E.G.I.S to stop them and save humanity once again.

(Source: ANN)",OVA,6,"Apr 24, 2002 to Jan 8, 2003",Finished Airing,UNKNOWN,Geneon Entertainment USA,Gonzo,Game,25 min per ep,PG-13 - Teens 13 or older,5125,5946,21,https://cdn.myanimelist.net/images/anime/6/75569.jpg
109,Gensoumaden Saiyuuki,Saiyuki,幻想魔伝 最遊記,7.55,"Action, Adventure, Comedy, Drama, Supernatural","Many years ago, humans and demons lived in harmony. But that unity ended when demons started attacking humans and plotted a mission to unleash Gyumao—an evil demon imprisoned for thousands of years. Now, Genjo Sanzo, a rogue priest, must team up with three demons—Sha Gojyo, Son Goku, and Cho Hakkai—and embark on a perilous journey to the west to stop these demons from resurrecting Gyumao and restore the balance between humans and demons on Earth.

(Source: ANN)",TV,50,"Apr 4, 2000 to Mar 27, 2001",Finished Airing,"TV Tokyo, Dentsu, Group TAC",ADV Films,Pierrot,Manga,23 min per ep,R - 17+ (violence & profanity),1545,2791,776,https://cdn.myanimelist.net/images/anime/11/75282.jpg
110,Saiyuuki Reload,Saiyuki Reload,最遊記RELOAD,7.37,"Action, Adventure, Comedy, Drama, Supernatural","Priest Genjo Sanzo and companions Cho Hakkai, Sha Gojyo, and Son Goku maintain their westward journey to stop the resurrection of the demon Gyoumao. As the reputation of the Sanzo Ikkou precedes them, they continue to fight demon assassins at every turn, but they must also deal with increasing tensions within their group in order to defeat a powerful enemy.

(Source: ANN)",TV,25,"Oct 2, 2003 to Mar 25, 2004",Finished Airing,UNKNOWN,"Discotek Media, Geneon Entertainment USA",Pierrot,Manga,23 min per ep,PG-13 - Teens 13 or older,2211,3560,112,https://cdn.myanimelist.net/images/anime/1037/134418.jpg
111,Saiyuuki Reload Gunlock,Saiyuki Gunlock,最遊記RELOAD GUNLOCK,7.37,"Action, Adventure, Comedy, Drama, Supernatural","The Sanzo Ikkou continues its westward journey, on a mission to prevent a demonic resurrection. As Genjo Sanzo, Cho Hakkai, Sha Gojyo, and Son Goku fight their way to their goal, their path is fraught with internal strife. When they encounter a formidable pair of adversaries from the west, the cohesion of the group -- and the fate of the mission -- may be at stake.

(Source: ANN)",TV,26,"Apr 2, 2004 to Sep 24, 2004",Finished Airing,UNKNOWN,Geneon Entertainment USA,Pierrot,Manga,24 min per ep,PG-13 - Teens 13 or older,2211,4298,46,https://cdn.myanimelist.net/images/anime/1348/134419.jpg
112,GetBackers,Getbackers,ゲットバッカーズ　奪還屋,7.58,"Action, Mystery, Supernatural","Mido Ban and Amano Ginji are known as the Get Backers, retrievers with a success rate of 100%. Whatever is lost or stolen, they can definitely get it back. Despite their powerful abilities and enthusiastic behavior, Ban and Ginji are terminally broke no matter what they do simply because few people would actually desire to hire them. As a result, the pair of them tend to do dangerous jobs, often leading to unwanted re-encounters with their old (and dangerous) friends.",TV,49,"Oct 5, 2002 to Sep 20, 2003",Finished Airing,"TBS, Kodansha, Rondo Robe, Rakuonsha","ADV Films, Sentai Filmworks",Studio Deen,Manga,24 min per ep,PG-13 - Teens 13 or older,1438,1703,867,https://cdn.myanimelist.net/images/anime/4/7547.jpg
113,Green Green,Green Green,グリーングリーン,6.15,"Comedy, Romance, Ecchi","Kanenone Gakuen is an all-male boarding school located in the countryside of Japan. Although an all-male school is nothing new, life can become quite difficult when there are no female students for miles around. In order to help the psychological health of everyone involved, the school board has decided to try and merge with the nearest all-girl boarding school in order to become co-ed. The boys of Kanenone are more than thrilled at the prospect, and the girls are curious as to how interesting school life might become if there were more boys around. Before any serious decisions are made, the girls have been invited to stay at Kanenone for one month as a test.

Green Green follows Yuusuke Takazaki and his naughty room mates called the Baka (Idiot) Trio, and their ability to talk to the girls without making complete fools of themselves. But as soon as the school bus with the girls arrives, things become weird, hormonal, and hysterical. In particular, a girl named Midori Chitose leaps off the bus and immediately embraces a very confused Yuusuke. Is he a natural ladies' man, or do the two of them have a shared history that he is not aware of?",TV,12,"Jul 13, 2003 to Sep 28, 2003",Finished Airing,"Pony Canyon, Memory-Tech, Studio Jack",Media Blasters,Studio Matrix,Visual novel,24 min per ep,R+ - Mild Nudity,8102,1750,221,https://cdn.myanimelist.net/images/anime/7/75251.jpg
114,Gunslinger Girl,Gunslinger Girl,ガンスリンガー・ガール,7.39,"Action, Drama, Sci-Fi","In the heart of Italy, the Social Welfare Agency rescues young girls from hospital beds and gives them a second chance at life using the latest in cybernetic advancements. With their artificially enhanced bodies, the girls are brainwashed and trained as assassins to carry out the dirty work of the Italian Government. Despite all the modifications, they are still just children at heart, struggling for recognition from those they love, even knowing the love they feel is manufactured. This tragic tale unfolds as these girls grapple with their emotions in an agency that treats them as nothing but ruthless killers.",TV,13,"Oct 9, 2003 to Feb 19, 2004",Finished Airing,"Marvelous, Fuji TV",Funimation,Madhouse,Manga,24 min per ep,R - 17+ (violence & profanity),2127,1191,1153,https://cdn.myanimelist.net/images/anime/5/3088.jpg
115,Hikaru no Go,Hikaru no Go,ヒカルの碁,8.08,"Comedy, Drama, Supernatural","While searching through his grandfather's attic, Hikaru Shindou stumbles upon an old go board. Touching it, he is greeted by a mysterious voice, and soon after falls unconscious. When he regains his senses, he discovers that the voice is still present and belongs to Fujiwara no Sai, the spirit of an ancient go expert. A go instructor for the Japanese Emperor in the Heian Era, Sai's passion for the game transcends time and space, allowing him to continue playing his beloved game as a ghostly entity. Sai's ultimate goal is to master a divine go technique that no player has achieved so far, and he seeks to accomplish this by playing the board game through Hikaru.

Despite having no interest in board games, Hikaru reluctantly agrees to play, executing moves as instructed by Sai. However, when he encounters the young go prodigy Akira Touya, a passion for the game is slowly ignited within him. Inspired by his newfound rival, Hikaru's journey into the world of go is just beginning.",TV,75,"Oct 10, 2001 to Mar 26, 2003",Finished Airing,"TV Tokyo, Dentsu, Dream Force",VIZ Media,Pierrot,Manga,23 min per ep,PG-13 - Teens 13 or older,491,1557,2341,https://cdn.myanimelist.net/images/anime/12/78317.jpg
116,Hunter x Hunter,Hunter x Hunter,HUNTER×HUNTER（ハンター×ハンター）,8.41,"Action, Adventure, Fantasy","Hunters are specialized in a wide variety of fields, ranging from treasure hunting to cooking. They have access to otherwise unavailable funds and information that allow them to pursue their dreams and interests. However, being a hunter is a special privilege, only attained by taking a deadly exam with an extremely low success rate.

Gon Freecss, a 12-year-old boy with the hope of finding his missing father, sets out on a quest to take the Hunter Exam. Along the way, he picks up three companions who also aim to take the dangerous test: the revenge-seeking Kurapika, aspiring doctor Leorio Paladiknight, and a mischievous child the same age as Gon, Killua Zoldyck.

As the four aspiring hunters embark on a perilous adventure, they fight for their dreams while defying the odds.",TV,62,"Oct 16, 1999 to Mar 31, 2001",Finished Airing,Fuji TV,VIZ Media,Nippon Animation,Manga,23 min per ep,PG-13 - Teens 13 or older,170,357,10442,https://cdn.myanimelist.net/images/anime/1305/132237.jpg
117,Hunter x Hunter: Original Video Animation,UNKNOWN,HUNTER×HUNTER Original Video Animation,8.31,"Action, Adventure, Fantasy","After reuniting with Gon and his friends, Kurapika explained to them the risks he bears because of his abilities. Believing that his target of revenge is no longer alive and the search for his fallen comrade's eyes could truly begin, Kurapika soon after receives a message informing him that all the Spiders still lived. After much discussion between his friends, Gon, Kurapika and company decided to hunt after the one Spider member who's ability could ultimately result in Kurapika's defeat and death. Based on the manga by Togashi Yoshihiro.",OVA,8,"Jan 17, 2002 to Apr 17, 2002",Finished Airing,UNKNOWN,UNKNOWN,Nippon Animation,Manga,24 min per ep,PG-13 - Teens 13 or older,239,1673,395,https://cdn.myanimelist.net/images/anime/1/137.jpg
118,Hunter x Hunter: Greed Island,UNKNOWN,HUNTER×HUNTER Greed Island,8.18,"Action, Adventure, Fantasy","After the battle with the Spiders, the search for Ging continues as Gon and Killua decided to once again attempt to purchase the rare game ""Greed Island."" However, Gon came up with a better plan, which was to volunteer to complete the game for the billionaire who owned it. But some training must be done, as Gon and Killua's abilities are still at a developing stage and ""Greed Island"" is no simple game for anyone to play with. It is the infamous game that could easily lead to one's death. Based on the manga by Togashi Yoshihiro.",OVA,8,"Feb 5, 2003 to Apr 16, 2003",Finished Airing,UNKNOWN,UNKNOWN,Nippon Animation,Manga,22 min per ep,PG-13 - Teens 13 or older,374,1429,284,https://cdn.myanimelist.net/images/anime/1902/122320.jpg
119,Hunter x Hunter: Greed Island Final,UNKNOWN,HUNTER×HUNTER G・I Final,8.25,"Action, Adventure, Fantasy","Continuing with their adventure at Greed Island, Gon and Killua train furiously under the guidance of Biscuit for better preparation at attempting the game. With their abilities vastly improving and the threat of player killers menacing Greed Island, Gon and company continue the game despite the dangers that they will face with the game activities and encounters with other players. Based on the manga by Togashi Yoshihiro.",OVA,14,"Mar 3, 2004 to Aug 18, 2004",Finished Airing,UNKNOWN,UNKNOWN,Nippon Animation,Manga,24 min per ep,PG-13 - Teens 13 or older,298,1506,238,https://cdn.myanimelist.net/images/anime/1/139.jpg
120,Jinki:Extend,Jinki: Extend,ジンキ・エクステンド,6.1,Sci-Fi,"Aoba is a young girl who loves to build models of robots. She lived alone with her grandmother until her grandmother passes away. Shortly after she is kidnapped and brought to a secret base where she discovers a huge robot. The piloted robots fight against Ancient-Jinki in The Grand Savanna, but the true meaning behind the fights is hidden. Aoba works hard at the base so one day she can pilot one of the robots and discover these secrets.",TV,12,"Jan 6, 2005 to Mar 24, 2005",Finished Airing,"TV Asahi, GANSIS","ADV Films, Funimation",feel.,Manga,23 min per ep,R - 17+ (violence & profanity),8385,5723,11,https://cdn.myanimelist.net/images/anime/3/44792.jpg
121,Kamikaze Kaitou Jeanne,UNKNOWN,神風怪盗ジャンヌ,7.46,"Action, Drama, Mystery, Romance, Supernatural","A normal looking high school girl on the outside, Kusakabe Maron is actually the reincarnation of Jeanne d' Arc. With the help of the angel, Fin Fish, Maron works as the thief Jeanne at night to seal the demons that reside in pieces of artwork, preying upon the weak hearts of the owners. She is branded as a thief due to the fact that the artworks disappear after she seals the demons. One day, a new neighbor and classmate appears, as well as a rival in her night job, the thief Sinbad. With her own best friend being the detective's daughter, out to capture her and the appearance of her new rival, Maron's work is anything but easy.",TV,44,"Feb 13, 1999 to Jan 29, 2000",Finished Airing,Toei Advertising,UNKNOWN,Toei Animation,Manga,24 min per ep,PG-13 - Teens 13 or older,1847,2764,496,https://cdn.myanimelist.net/images/anime/5/20389.jpg
122,Kannazuki no Miko,Destiny of the Shrine Maiden,神無月の巫女,6.81,"Drama, Girls Love, Romance, Supernatural","Kannazuki no Miko begins in the village of Mahoroba, where time passes slowly for both man and nature. Two students from the village's prestigious Ototachibana Academy might as well be night and day. Himeko is shy and unassertive, while Chikane is bold and elegant. Despite this, they love each other, and nothing can come between them, no matter how hard they try.

On the two girls' shared birthday, a sinister voice corrupts one of their friends into attacking them, and just when it seemed grimmest, the lunar and solar priestess powers that lay dormant in the two girls awaken, dispelling the evil. That was only the first hurdle, however. The two must now fend off the countless others who would threaten their well-being—even the people closest to them!",TV,12,"Oct 2, 2004 to Dec 18, 2004",Finished Airing,"Studio Fantasia, Geneon Universal Entertainment, Remic, Front Line, Kodansha, Rondo Robe, Memory-Tech, Toshiba Entertainment","Sentai Filmworks, Geneon Entertainment USA",TNK,Manga,24 min per ep,PG-13 - Teens 13 or older,4801,2436,701,https://cdn.myanimelist.net/images/anime/8/73955.jpg
123,Kanon,UNKNOWN,カノン,7.07,"Drama, Romance, Supernatural","It’s been 7 years since Yuuichi Aizawa visited his aunt Akiko, but now that his parents have gone to Africa to pursue their careers, he is finally back in the little northern town. Yuuichi is not really overjoyed with the prospect of living here though, because all of his memories of this place and the people living in it have mysteriously vanished. His cute cousin Nayuki seems like a stranger as well, even though he used to play with her all the time when they were younger.

On the day of moving into his new home, Yuuichi starts unpacking the boxes and stumbles upon a red headband that no one seems to recognize. This is one of the first clues that will make Yuuichi take a stroll through the snow-covered town and make him start recalling fragments of his past, broken promises and buried secrets. Yuuichi soon realizes that there is something supernatural going on, and all of his new female acquaintances seem to have links to his forgotten past.",TV,13,"Jan 31, 2002 to Mar 28, 2002",Finished Airing,"Movic, Fuji TV, Fujipacific Music",UNKNOWN,Toei Animation,Visual novel,24 min per ep,G - All Ages,3669,2542,220,https://cdn.myanimelist.net/images/anime/1552/128388.jpg
124,Kareshi Kanojo no Jijou,His and Her Circumstances,彼氏彼女の事情,7.59,"Comedy, Drama, Romance","Yukino Miyazawa is the female representative for her class and the most popular girl among the freshmen at her high school. Good at both academics and sports on top of being elegant and sociable, she has been an object of admiration all her life. However, in reality, she is an incredibly vain person who toils relentlessly to maintain her good grades, athleticism, and graceful appearance. She wants nothing more than to be the center of attention and praise—which is why she cannot stand Souichirou Arima, the male representative for her class and the only person more perfect than her. Since the first day of high school, she has struggled to steal the spotlight from her new rival but to no avail.

At last, on the midterm exams, Yukino gets the top score and beats Souichirou. But, to her surprise, he congratulates her on her achievement, leading her to question her deceptive lifestyle. When Souichirou confesses his love to Yukino, she turns him down and gloats about it at home with only a hint of regret. But the very next day, Souichirou visits Yukino house to bring her a CD and sees her uninhibited self in action; now equipped with the truth, he blackmails her into completing his student council duties. Coerced into spending time with Souichirou, Yukino learns that she is not the only one hiding secrets.",TV,26,"Oct 2, 1998 to Mar 26, 1999",Finished Airing,"TV Tokyo, GANSIS",Nozomi Entertainment,"Gainax, J.C.Staff",Manga,24 min per ep,PG-13 - Teens 13 or older,1402,1023,2517,https://cdn.myanimelist.net/images/anime/1222/108880.jpg
125,Kono Minikuku mo Utsukushii Sekai,This Ugly Yet Beautiful World,この醜くも美しい世界,6.71,"Comedy, Drama, Romance, Sci-Fi, Ecchi","High school student Takeru Takemoto works part time as a (motor)bike courier. During one of his deliveries, he saw a mysterious light passing him and fell into a forest. What he had found was a beautiful girl coming out from a glowing cocoon, calling herself ""Hikari."" While Takeru was quite embarrassed because of Hikari's nudity, a strange monster suddenly showed up and immediately attacked the two. Both Takeru and Hikari demonstrated the power of their other selves before Takeru had a clue of what's going on.

(Source: ANN)",TV,12,"Apr 2, 2004 to Jun 18, 2004",Finished Airing,"Geneon Universal Entertainment, TBS, Rondo Robe, Movic",ADV Films,"Gainax, Shaft",Original,24 min per ep,R+ - Mild Nudity,5291,2647,151,https://cdn.myanimelist.net/images/anime/10/21035.jpg
126,Kimi ga Nozomu Eien,Rumbling Hearts,君が望む永遠,7.18,"Drama, Romance","In the warmth of a golden sun, timid high school student Haruka Suzumiya confesses to Takayuki Narumi, the boy she admires. Takayuki accepts Haruka's confession and the two become a couple, supported by their mutual friends Mitsuki Hayase and Shinji Taira. All is well for these friends—until tragedy strikes.

One of them is sent to an unenviable fate, lying dormant in a coma. Three years later, they awaken, but their sudden reappearance in everyone's lives threatens to test the limits of these friends' bonds.",TV,14,"Oct 5, 2003 to Jan 4, 2004",Finished Airing,"Lantis, Media Factory, Age",Funimation,Studio Fantasia,Visual novel,23 min per ep,R+ - Mild Nudity,3122,1511,1048,https://cdn.myanimelist.net/images/anime/5/10227.jpg
127,Kita e.: Diamond Dust Drops,Diamond Daydreams,北へ。 ～Diamond Dust Drops～,6.56,"Drama, Romance","If a couple sees the diamond dust together, then they will certainly find eternal happiness. Or so it is said. This is a drama about the romances, friendships and conflicts of six girls from Hokkaido and how the diamond dust affects them and eventually links them together in the search for happiness.

(Source: ANN)",TV,12,"Jan 20, 2004 to Apr 5, 2004",Finished Airing,UNKNOWN,ADV Films,Studio Deen,Visual novel,24 min per ep,PG-13 - Teens 13 or older,6039,6300,10,https://cdn.myanimelist.net/images/anime/1488/132892.jpg
