anime_id,Name,English name,Other name,Score,Genres,Synopsis,Type,Episodes,Aired,Status,Producers,Licensors,Studios,Source,Duration,Rating,Rank,Popularity,Favorites,Image URL
1,Cowboy Bebop,Cowboy Bebop,カウボーイビバップ,8.75,"Action, Award Winning, Sci-Fi","Crime is timeless. By the year 2071, humanity has expanded across the galaxy, filling the surface of other planets with settlements like those on Earth. These new societies are plagued by murder, drug use, and theft, and intergalactic outlaws are hunted by a growing number of tough bounty hunters.

Spike Spiegel and Jet Black pursue criminals throughout space to make a humble living. Beneath his goofy and aloof demeanor, Spike is haunted by the weight of his violent past. Meanwhile, Jet manages his own troubled memories while taking care of Spike and the Bebop, their ship. The duo is joined by the beautiful con artist Faye Valentine, odd child Edward Wong Hau Pepelu Tivrusky IV, and Ein, a bioengineered Welsh Corgi.

While developing bonds and working to catch a colorful cast of criminals, the Bebop crew's lives are disrupted by a menace from Spike's past. As a rival's maniacal plot continues to unravel, Spike must choose between life with his newfound family or revenge for his old wounds.",TV,26,"Apr 3, 1998 to Apr 24, 1999",Finished Airing,Bandai Visual,"Funimation, Bandai Entertainment",Sunrise,Original,24 min per ep,R - 17+ (violence & profanity),41,43,78525,https://cdn.myanimelist.net/images/anime/4/19644.jpg
2,Cowboy Bebop: Tengoku no Tobira,Cowboy Bebop: The Movie,カウボーイビバップ 天国の扉,8.38,"Action, Sci-Fi","Another day, another bounty—such is the life of the often unlucky crew of the Bebop. However, this routine is interrupted when Faye, who is chasing a fairly worthless target on Mars, witnesses an oil tanker suddenly explode, causing mass hysteria. As casualties mount due to a strange disease spreading through the smoke from the blast, a whopping three hundred million woolong price is placed on the head of the supposed perpetrator.

With lives at stake and a solution to their money problems in sight, the Bebop crew springs into action. Spike, Jet, Faye, and Edward, followed closely by Ein, split up to pursue different leads across Alba City. Through their individual investigations, they discover a cover-up scheme involving a pharmaceutical company, revealing a plot that reaches much further than the ragtag team of bounty hunters could have realized.",Movie,1,"Sep 1, 2001",Finished Airing,"Sunrise, Bandai Visual",Sony Pictures Entertainment,Bones,Original,1 hr 55 min,R - 17+ (violence & profanity),189,602,1448,https://cdn.myanimelist.net/images/anime/1439/93480.jpg
3,Trigun,Trigun,トライガン,8.22,"Action, Adventure, Sci-Fi","Vash the Stampede is the man with a $$60,000,000,000 bounty on his head. The reason: he's a merciless villain who lays waste to all those that oppose him and flattens entire cities for fun, garnering him the title ""The Humanoid Typhoon."" He leaves a trail of death and destruction wherever he goes, and anyone can count themselves dead if they so much as make eye contact—or so the rumors say. In actuality, Vash is a huge softie who claims to have never taken a life and avoids violence at all costs.

With his crazy doughnut obsession and buffoonish attitude in tow, Vash traverses the wasteland of the planet Gunsmoke, all the while followed by two insurance agents, Meryl Stryfe and Milly Thompson, who attempt to minimize his impact on the public. But soon, their misadventures evolve into life-or-death situations as a group of legendary assassins are summoned to bring about suffering to the trio. Vash's agonizing past will be unraveled and his morality and principles pushed to the breaking point.",TV,26,"Apr 1, 1998 to Sep 30, 1998",Finished Airing,Victor Entertainment,"Funimation, Geneon Entertainment USA",Madhouse,Manga,24 min per ep,PG-13 - Teens 13 or older,328,246,15035,https://cdn.myanimelist.net/images/anime/7/20310.jpg
4,Witch Hunter Robin,Witch Hunter Robin,Witch Hunter ROBIN (ウイッチハンターロビン),7.25,"Action, Drama, Mystery, Supernatural","Robin Sena is a powerful craft user drafted into the STNJ—a group of specialized hunters that fight deadly beings known as Witches. Though her fire power is great, she's got a lot to learn about her powers and working with her cool and aloof partner, Amon. But the truth about the Witches and herself will leave Robin on an entirely new path that she never expected!

(Source: Funimation)",TV,26,"Jul 3, 2002 to Dec 25, 2002",Finished Airing,"Bandai Visual, Dentsu, Victor Entertainment, TV Tokyo Music","Funimation, Bandai Entertainment",Sunrise,Original,25 min per ep,PG-13 - Teens 13 or older,2764,1795,613,https://cdn.myanimelist.net/images/anime/10/19969.jpg
5,Bouken Ou Beet,Beet the Vandel Buster,冒険王ビィト,6.94,"Adventure, Fantasy, Supernatural","It is the dark century and the people are suffering under the rule of the devil, Vandel, who is able to manipulate monsters. The Vandel Busters are a group of people who hunt these devils, and among them, the Zenon Squad is known to be the strongest busters on the continent. A young boy, Beet, dreams of joining the Zenon Squad. However, one day, as a result of Beet's fault, the Zenon squad was defeated by the devil, Beltose. The five dying busters sacrificed their life power into their five weapons, Saiga. After giving their weapons to Beet, they passed away. Years have passed since then and the young Vandel Buster, Beet, begins his adventure to carry out the Zenon Squad's will to put an end to the dark century.",TV,52,"Sep 30, 2004 to Sep 29, 2005",Finished Airing,"TV Tokyo, Dentsu",Illumitoon Entertainment,Toei Animation,Manga,23 min per ep,PG - Children,4240,5126,14,https://cdn.myanimelist.net/images/anime/7/21569.jpg
6,Eyeshield 21,UNKNOWN,アイシールド21,7.92,Sports,"Shy, reserved, and small-statured, Deimon High School student Sena Kobayakawa is the perfect target for bullies. However, as a result of running errands throughout his life, Sena has become agile and developed a skill for avoiding crowds of people. After the cunning Youichi Hiruma—captain of the Deimon Devil Bats football team—witnesses Sena's rapid legs in motion, he coerces the timid boy into joining his squad.

As Hiruma wants to conceal Sena's identity from other clubs, Sena is forced to hide under the visored helmet of ""Eyeshield 21,"" a mysterious running back wearing the number 21 jersey. The legendary Eyeshield 21 can supposedly run at the speed of light and has achieved remarkable feats in the United States during his time at the Notre Dame College.

Accustomed to avoiding his problems in the past, Sena's specialty might just help him become the new secret weapon of the Deimon Devil Bats. As he interacts with his teammates, Sena gradually gains more self-confidence and forges valuable bonds along the way.",TV,145,"Apr 6, 2005 to Mar 19, 2008",Finished Airing,"TV Tokyo, Nihon Ad Systems, TV Tokyo Music, Shueisha","VIZ Media, Sentai Filmworks",Gallop,Manga,23 min per ep,PG-13 - Teens 13 or older,688,1252,1997,https://cdn.myanimelist.net/images/anime/1079/133529.jpg
7,Hachimitsu to Clover,Honey and Clover,ハチミツとクローバー,8,"Comedy, Drama, Romance","Yuuta Takemoto, a sophomore at an arts college, shares a cheap apartment with two seniors—the eccentric Shinobu Morita, who keeps failing to graduate due to his absenteeism, and the sensible Takumi Mayama, who acts as a proper senior to Takemoto, often looking out for him.

Takemoto had not given much thought to his future until one fine spring day, when he meets the endearing Hagumi Hanamoto and falls in love at first sight. Incredibly gifted in the arts, Hagumi enrolls in Takemoto's university and soon befriends the popular pottery student Ayumi Yamada. Ayumi is already well acquainted with the three flatmates and secretly harbors deep feelings for one of them.

Hachimitsu to Clover is a heartwarming tale of youth, love, soul-searching, and self-discovery, intricately woven through the complex relationships between five dear friends.",TV,24,"Apr 15, 2005 to Sep 27, 2005",Finished Airing,"Dentsu, Genco, Fuji TV, Asmik Ace, Shueisha","VIZ Media, Discotek Media",J.C.Staff,Manga,23 min per ep,PG-13 - Teens 13 or older,589,862,4136,https://cdn.myanimelist.net/images/anime/1301/133577.jpg
8,Hungry Heart: Wild Striker,UNKNOWN,ハングリーハート Wild Striker,7.55,"Comedy, Slice of Life, Sports","As the younger brother of Japanese soccer star Seisuke Kanou, Kyousuke was always expected to grow as a soccer player at the same pace his brother did—an expectation that proved too difficult to meet. Having fallen behind, he now lives in the shadow of his brother's success.

Entering his freshman year at Jouyou Akanegaoka High School, Kyousuke vows never to play soccer again. However, Miki Tsujiwaki, the captain of the girls' soccer team, and Mori Kazuto, the manager of the boys' team, recognize Kyousuke's potential and want to see his return to the game for their own reasons.

With an opportunity to play soccer again, Kyousuke must either remain steadfast in his decision to abandon the sport he once loved, or allow himself to reignite that flame to become the best striker in the world.",TV,52,"Sep 11, 2002 to Sep 10, 2003",Finished Airing,UNKNOWN,UNKNOWN,Nippon Animation,Manga,23 min per ep,PG-13 - Teens 13 or older,1551,4212,237,https://cdn.myanimelist.net/images/anime/12/49655.jpg
9,Initial D Fourth Stage,UNKNOWN,頭文字〈イニシャル〉D FOURTH STAGE,8.16,"Action, Drama","Takumi Fujiwara finally joins Ryousuke and Keisuke Takahashi to create ""Project D."" Their goal is twofold: Ryousuke wants to develop his ""High-Speed Street Racing Theory,"" while Keisuke and Takumi aim at improving their driving skills by facing powerful opponents on dangerous roads. The idea of Project D is to challenge street racing teams from other prefectures to improve both their uphill and downhill records. In order to attract the attention of the best racing teams, Ryousuke creates a dedicated website to announce the future battles of Project D and post the team's results.

The fourth season of Initial D details the hardships and successes of the members of Project D as they try to become the best street racing team outside of Gunma Prefecture.",TV,24,"Apr 17, 2004 to Feb 18, 2006",Finished Airing,"OB Planning, Studio Jack",Funimation,A.C.G.T.,Manga,27 min per ep,PG-13 - Teens 13 or older,393,1273,1237,https://cdn.myanimelist.net/images/anime/9/10521.jpg
10,Monster,Monster,モンスター,8.87,"Drama, Mystery, Suspense","Dr. Kenzou Tenma, an elite neurosurgeon recently engaged to his hospital director's daughter, is well on his way to ascending the hospital hierarchy. That is until one night, a seemingly small event changes Dr. Tenma's life forever. While preparing to perform surgery on someone, he gets a call from the hospital director telling him to switch patients and instead perform life-saving brain surgery on a famous performer. His fellow doctors, fiancée, and the hospital director applaud his accomplishment; but because of the switch, a poor immigrant worker is dead, causing Dr. Tenma to have a crisis of conscience.

So when a similar situation arises, Dr. Tenma stands his ground and chooses to perform surgery on the young boy Johan Liebert instead of the town's mayor. Unfortunately, this choice leads to serious ramifications for Dr. Tenma—losing his social standing being one of them. However, with the mysterious death of the director and two other doctors, Dr. Tenma's position is restored. With no evidence to convict him, he is released and goes on to attain the position of hospital director.

Nine years later when Dr. Tenma saves the life of a criminal, his past comes back to haunt him—once again, he comes face to face with the monster he operated on. He must now embark on a quest of pursuit to make amends for the havoc spread by the one he saved.",TV,74,"Apr 7, 2004 to Sep 28, 2005",Finished Airing,"VAP, Shogakukan-Shueisha Productions, Nippon Television Network",VIZ Media,Madhouse,Manga,24 min per ep,R+ - Mild Nudity,26,142,47235,https://cdn.myanimelist.net/images/anime/10/18793.jpg
11,Naruto,Naruto,ナルト,7.99,"Action, Adventure, Fantasy","Moments prior to Naruto Uzumaki's birth, a huge demon known as the Kyuubi, the Nine-Tailed Fox, attacked Konohagakure, the Hidden Leaf Village, and wreaked havoc. In order to put an end to the Kyuubi's rampage, the leader of the village, the Fourth Hokage, sacrificed his life and sealed the monstrous beast inside the newborn Naruto.

Now, Naruto is a hyperactive and knuckle-headed ninja still living in Konohagakure. Shunned because of the Kyuubi inside him, Naruto struggles to find his place in the village, while his burning desire to become the Hokage of Konohagakure leads him not only to some great new friends, but also some deadly foes.",TV,220,"Oct 3, 2002 to Feb 8, 2007",Finished Airing,"TV Tokyo, Aniplex, Shueisha",VIZ Media,Pierrot,Manga,23 min per ep,PG-13 - Teens 13 or older,599,8,76343,https://cdn.myanimelist.net/images/anime/13/17405.jpg
12,One Piece,One Piece,ONE PIECE,8.69,"Action, Adventure, Fantasy","Gol D. Roger was known as the ""Pirate King,"" the strongest and most infamous being to have sailed the Grand Line. The capture and execution of Roger by the World Government brought a change throughout the world. His last words before his death revealed the existence of the greatest treasure in the world, One Piece. It was this revelation that brought about the Grand Age of Pirates, men who dreamed of finding One Piece—which promises an unlimited amount of riches and fame—and quite possibly the pinnacle of glory and the title of the Pirate King.

Enter Monkey D. Luffy, a 17-year-old boy who defies your standard definition of a pirate. Rather than the popular persona of a wicked, hardened, toothless pirate ransacking villages for fun, Luffy's reason for being a pirate is one of pure wonder: the thought of an exciting adventure that leads him to intriguing people and ultimately, the promised treasure. Following in the footsteps of his childhood hero, Luffy and his crew travel across the Grand Line, experiencing crazy adventures, unveiling dark mysteries and battling strong enemies, all in order to reach the most coveted of all fortunes—One Piece.",TV,UNKNOWN,"Oct 20, 1999 to ?",Currently Airing,"Fuji TV, TAP, Shueisha","Funimation, 4Kids Entertainment",Toei Animation,Manga,24 min,PG-13 - Teens 13 or older,55,20,198986,https://cdn.myanimelist.net/images/anime/6/73245.jpg
13,Tennis no Ouji-sama,The Prince of Tennis,テニスの王子様,7.86,Sports,"At the request of his father, tennis prodigy Ryouma Echizen has returned from America and is ready to take the Japanese tennis scene by storm. Aiming to become the best tennis player in the country, he enrolls in Seishun Academy—home to one of the best middle school tennis teams in Japan.

After Ryouma catches the captain's eye, he finds himself playing for a spot on the starting lineup in the intra-school ranking matches despite only being a freshman. Due to his age, the rest of the Seishun Boys' Tennis Team are initially reluctant to accept him, but his skill and determination convinces them to let him in.

Armed with their new ""super rookie,"" Seishun sets out to claim a spot in the National Tournament, hoping to take the coveted title for themselves. In order to do so, the team must qualify by playing through the Tokyo Prefectural and Kanto Regionals. Yet, the road ahead of them is shared by a plethora of strong schools, each playing tennis in unique ways for their own reasons. Ryouma and his teammates must learn to cooperate if they want to become the champions they aspire to be.",TV,178,"Oct 10, 2001 to Mar 23, 2005",Finished Airing,"Production I.G, Nihon Ad Systems","Funimation, VIZ Media",Trans Arts,Manga,22 min per ep,PG-13 - Teens 13 or older,805,1246,3004,https://cdn.myanimelist.net/images/anime/6/21624.jpg
14,Ring ni Kakero 1,UNKNOWN,リングにかけろ１,6.39,"Action, Sports","In order to fulfill their dead father's wish, the siblings Takane Kiku and Takane Ryuji aim for the champion title of the boxing arena. Their sister, Kiku, will act as the trainer while her brother, Ryuji, will concentrate on the role of the boxer and learn the Boomerang. His battle with many rivals has led to the growth and maturing of Ryuji. The junior high boxing tournament has begun and Ryuji will be fighting his arch-rival, Kenzaki Jun. The battle begins.

(Source: ANN)",TV,12,"Oct 6, 2004 to Dec 15, 2004",Finished Airing,UNKNOWN,UNKNOWN,Toei Animation,Manga,25 min per ep,PG - Children,6943,8288,6,https://cdn.myanimelist.net/images/anime/1146/124743.jpg
15,School Rumble,School Rumble,スクールランブル,7.89,"Comedy, Romance","Just the words ""I love you,"" and everything changes—such is the nature of the bittersweet trials of high school romance. Tenma Tsukamoto, a second year, is on a quest to confess her feelings to the boy she likes. Kenji Harima, a delinquent with a sizable reputation, is in a similar situation, as he cannot properly convey his feelings to the one he loves. Between school, friends, rivalries, and hobbies, these two will find that high school romance is no walk in the park, especially as misunderstandings further complicate their plight.

School Rumble is a high-octane romantic comedy full of relatable situations, as Tenma and Kenji both try to win the hearts of those they desire.",TV,26,"Oct 5, 2004 to Mar 29, 2005",Finished Airing,"TV Tokyo, Sotsu, Marvelous, Starchild Records, Media Factory, DAX Production, Studio Jack",Funimation,Studio Comet,Manga,23 min per ep,PG-13 - Teens 13 or older,756,687,5139,https://cdn.myanimelist.net/images/anime/4/75488.jpg
16,Sunabouzu,Desert Punk,砂ぼうず,7.38,"Action, Adventure, Comedy, Sci-Fi, Ecchi","The Great Kanto Desert, a sweltering wasteland of nothing but ruins and sand, is all that remains of post-apocalyptic Japan. The once fair population has been left to cling to the inhospitable dunes for survival. At least, that is the case for normal people. For those who have spent a little too long in the Kanto sun, the desert offers a wondrous opportunity to make a name for themselves.

One such person is the masked handyman ""Sunabouzu,"" or Desert Punk, who has forged a legendary reputation for always finishing his jobs, no matter the nature or cost. Cunning and ruthless, he has become a force of crude destruction to the other desert people. However, the ""Vixen of the Desert,"" Junko Asagiri, discovers that Sunabouzu is not without his weaknesses—he is easily swayed by his insatiable lust for large-breasted desert babes.

Following their chaotic adventures through the Kanto Desert, Sunabouzu features a bizarre cast of personalities who entertain themselves with senseless violence and perversion in a world long destroyed by their forefathers. And just like them, they have not learned a damn thing.",TV,24,"Oct 6, 2004 to Mar 30, 2005",Finished Airing,"GDH, Pony Canyon, CBC Television",Funimation,Gonzo,Manga,24 min per ep,R - 17+ (violence & profanity),2167,1546,822,https://cdn.myanimelist.net/images/anime/6/75536.jpg
17,Texhnolyze,Texhnolyze,TEXHNOLYZE,7.76,"Action, Drama, Sci-Fi","In the dark underground city of Lux, people live in fear and despair under the rule of various criminal factions. Almost secluded from the surface, the gangs' only interaction with the outer world is their mining operation of ""raffia,"" which is the raison d'être of the city.

Available only in Lux, this rare substance is the basis of ""texhnolyze"" transplants that permit humans to replace parts of their body with cybernetic prostheses. The latter have the particularity not to trigger an immune response in their hosts and the ""Class"" has the privilege to conduct research on them. This elusive organization, also in charge of the raffia production, delegates its executive authority to a group called Organo led by Keigo Oonishi—a self-righteous man with texhnolyzed legs who is rumored to hear the ""voice of the city.""

The fragile balance of powers in Lux is disturbed when a mysterious visitor named Kazuho Yoshii begins committing a series of crimes that puts the gangs at each other's throats. In the midst of the chaos, new actors emerge: Ichise, an ex-boxer mutilated by Organo and recently texhnolyzed by Eriko ""Doc"" Kamata; and Ran, a young florist who can see the future. While Lux steadily plunges into insanity, both Ichise and Ran find themselves involved in the greatest crisis the city has ever faced.",TV,22,"Apr 17, 2003 to Sep 25, 2003",Finished Airing,"Group TAC, Rondo Robe, Fuji TV, Pioneer LDC","Funimation, Geneon Entertainment USA",Madhouse,Original,23 min per ep,R+ - Mild Nudity,990,935,4786,https://cdn.myanimelist.net/images/anime/1027/131977.jpg
18,Trinity Blood,Trinity Blood,トリニティ・ブラッド,7.29,"Action, Supernatural","Following Armageddon, an apocalyptic war, mankind faces yet another menace: vampires. The continuous confrontations between the races have split the world into separate factions. The race of vampires, Methuselah, are affiliated with the New Human Empire; whereas the humans, deemed Terrans by the vampires, make up the Vatican Papal State. Furthermore, extremist groups like the Rosenkreuz Order strive to rekindle a war, despite the factions' attempts to avoid direct conflict.

To combat terrorist organizations, the Vatican has implemented the AX unit. Led by Cardinal Caterina Sforza, the AX agents investigate vampire-related disturbances with hopes that the Terrans and the Methuselah will one day achieve peaceful coexistence. Amongst the AX unit is priest Abel Nightroad—a seemingly disoriented but gentle-hearted fellow who is a fierce vampire slayer on the battlefield. Joining the unit as his partner is agent Sister Esther Blanchett, a brave and gentle young nun troubled with a tragic past.

As the two grow closer, they begin to uncover signs of malicious schemes and dark forces working in the shadows. But the path they walk is riddled with misfortune that might just force them to confront the memories that plague their hearts.",TV,24,"Apr 29, 2005 to Oct 28, 2005",Finished Airing,UNKNOWN,Funimation,Gonzo,Light novel,24 min per ep,R - 17+ (violence & profanity),2591,1233,1298,https://cdn.myanimelist.net/images/anime/10/24649.jpg
19,Yakitate!! Japan,Yakitate!! Japan,焼きたて!! ジャぱん,7.91,"Comedy, Gourmet","While countries such as France, England, and Germany all have their own internationally celebrated bread, Japan simply does not have one that can match in reputation.

Thus after discovering the wonders of breadmaking at a young age, Kazuma Azuma embarks on a quest to create Japan's own unique national bread. And being blessed with unusually warm hands that allow dough to ferment faster, Azuma is able to bring his baking innovations to another level.

As he begins working at the prestigious Japanese bakery chain, Pantasia, Azuma encounters other talented bakers and experiences firsthand the competitive world of baking. Along with his newfound friends and rivals, Azuma strives to create new and unparalleled bread that will start a baking revolution.",TV,69,"Oct 12, 2004 to Mar 14, 2006",Finished Airing,"TV Tokyo, Aniplex, d-rights, Tohokushinsha Film Corporation, Atelier Musa",Nozomi Entertainment,Sunrise,Manga,24 min per ep,PG-13 - Teens 13 or older,704,1992,897,https://cdn.myanimelist.net/images/anime/3/76432.jpg
20,Zipang,UNKNOWN,ジパング,7.48,"Action, Drama, Sci-Fi","Mirai, an improved Kongou-class Aegis guided missile destroyer, is one of the newest and most advanced ships in the entire Japanese Self Defense Force (SDF). Her crew, also one of the newest, is lead by Capt. Umezu Saburo and Executive Officer Kadomatsu Yosuke. While running scheduled training exercises one day, Mirai encounters a fierce storm that throws their navigation systems into temporary disarray. After a few minutes of recovery, the crew is shocked to discover that they've been transported back in time to June 4, 1942—The Battle of Midway, during World War II. Letting history take its course for this battle, they manage to avoid the conflict firsthand and make a vow to remain anonymous, changing history as little as possible. However, when the crew comes across the dying Lt. Commander Kusaka Takumi, XO. Kadomatsu's instincts to save lives takes over, changing the course of history more than he could've imagined.

(Source: ANN)",TV,26,"Oct 8, 2004 to Apr 1, 2005",Finished Airing,"Marvelous, TBS",Geneon Entertainment USA,Studio Deen,Manga,24 min per ep,PG-13 - Teens 13 or older,1778,4430,180,https://cdn.myanimelist.net/images/anime/13/75740.jpg
