anime_id,Name,English name,Other name,Score,Genres,Synopsis,Type,Episodes,Aired,Status,Producers,Licensors,Studios,Source,Duration,Rating,Rank,Popularity,Favorites,Image URL
42,Chrno Crusade,Chrono Crusade,クロノクルセイド,7.62,"Action, Romance, Supernatural","The 1920s was a decade of great change and upheaval, with monstrous demons appearing across America. To combat this menace, the holy organization known as the Order of Magdalene was established. The organization's New York branch is home to the young and reckless Sister Rosette Christopher, as well as her partner Chrno. Tasked with the extermination of demonic threats, the renowned team is excellent at their job, despite causing extensive collateral damage on their missions.

However, both Rosette and Chrno are driven by their dark pasts. Through exterminating demons, Rosette hopes to find her lost brother Joshua who was taken by the sinner and demon, Aion, with whom Chrno also shares a bloody history. The two of them must fight off the increasingly dangerous demonic menace and discover its source, while continuing to search for the truth behind Joshua's disappearance.",TV,24,"Nov 25, 2003 to Jun 10, 2004",Finished Airing,"Lantis, Kadokawa Shoten, Fuji TV","ADV Films, Funimation",Gonzo,Manga,23 min per ep,R - 17+ (violence & profanity),1322,1010,1939,https://cdn.myanimelist.net/images/anime/13/14141.jpg
43,D.N.Angel,D.N.Angel,Ｄ・Ｎ・ＡＮＧＥＬ,7.17,"Action, Comedy, Fantasy, Romance","Daisuke Niwa is a clumsy, block-headed, and wimpy middle school student who has few redeeming qualities. On his 14th birthday, he finally decides to confess his love to his longtime crush Risa Harada, but is rejected.

In an unexpected turn of events, however, Daisuke finds himself transforming into Dark Mousy, the infamous phantom thief, whenever his mind is set on Risa. Though Daisuke is unaware of this strange heritage, his mother is certainly not: since before the boy was born, his mother had been planning for him to steal valuable works of art and let the name of the elusive art thief be known.

With doubt and confusion constantly clouding his mind, Daisuke finds himself struggling in his relationships with classmates and family. And it is not long before Daisuke realizes that he is not the only one with a fated family legacy—his greatest adversary could be the one classmate he is most unwilling to fight.",TV,26,"Apr 3, 2003 to Sep 25, 2003",Finished Airing,Kadokawa Shoten,"ADV Films, Discotek Media",Xebec,Manga,23 min per ep,PG-13 - Teens 13 or older,3180,1211,1257,https://cdn.myanimelist.net/images/anime/1126/98904.jpg
44,D.C.: Da Capo,D.C.~Da Capo~,D.C.～ダ・カーポ～,6.72,"Drama, Romance","Hatsunejima abounds in mysteries—one of which is the town's unwithering cherry trees that are said to grant the most genuine wishes. There are also rumors of people possessing supernatural powers, like Junichi Asakura, who can see other people's dreams and create sweets out of nothing. Alongside his sister Nemu, he enjoys living in peace with his friends at Kazami Academy but chooses to shroud his identity in secrecy.

His tranquil school life comes to a halt when he finds out that his childhood friend Sakura Yoshino has returned from America after six years. She is there for one purpose: to fulfill the promises she made long ago with Junichi. Little does anyone know, however, that Sakura's appearance is bound to change everyone's lives—for better or worse.",TV,26,"Jul 5, 2003 to Dec 27, 2003",Finished Airing,"Lantis, King Records",UNKNOWN,"feel., Zexcs",Visual novel,24 min per ep,PG-13 - Teens 13 or older,5215,2320,194,https://cdn.myanimelist.net/images/anime/4/73936.jpg
45,DearS,DearS,ディアーズ,6.56,"Comedy, Romance, Sci-Fi, Ecchi","One year ago, a UFO containing 150 aliens crash-landed off the shores of Kasai. Because no one could fix their ship, the Japanese Government decided to bestow upon them the designation ""DearS"" and make them into Japanese citizens, teaching them the language, customs, and culture of Japan. However, in order for them to become more familiar with human society, a home-stay program has been enacted to allow them to mingle with other humans.

One misty morning, a truck carrying a capsule that housed one of these aliens ends up dropping it into the riverbank, releasing her from her confinement. She is eventually found by a high school student named Takeya Ikuhara, who saves her from being hit by a truck and takes pity on her, despite being extremely distrustful of their race and wanting nothing to do with them. Upon being named Ren, she imprints upon him as her ""Master"" and serves as his personal ""Slave,"" leaving him with a ""DearS"" who wants to remain with him no matter what and bringing his ordinary, alien-free days to an end.",TV,12,"Jul 11, 2004 to Sep 26, 2004",Finished Airing,"Bandai Visual, Hal Film Maker, Genco, Lantis","Discotek Media, Geneon Entertainment USA",Daume,Manga,23 min per ep,R+ - Mild Nudity,6027,1460,346,https://cdn.myanimelist.net/images/anime/1207/98872.jpg
46,Rozen Maiden,Rozen Maiden,ローゼンメイデン,7.41,"Action, Comedy, Drama","Traumatized by school, Jun Sakurada spends his days at home as a shut-in, purchasing things online, only to send them back before the free trial period ends. So when a note appears on his desk, asking whether or not he would wind something, he assumes it was something he ordered and carelessly circles ""yes,"" changing his life forever.

A box arrives with a wind up doll inside, but this is no ordinary toy: after Jun winds her up, she begins walking and talking as if a normal person. With a haughty attitude, she introduces herself as Shinku, the fifth doll in the Rozen Maiden collection, a group of special dolls made by the legendary dollmaker Rozen. These sisters must battle each other in a competition called the Alice Game with the help of a human to ensure victory. The winner becomes Alice, a real girl who is worthy of meeting their creator.

As more sentient dolls end up taking residence in Jun's house, and a foe from Shinku's past makes her appearance, Jun's life becomes far more complicated than he ever thought possible.",TV,12,"Oct 8, 2004 to Dec 24, 2004",Finished Airing,"Mellow Head, Pony Canyon, TBS, Memory-Tech, Studio Jack","Sentai Filmworks, Geneon Entertainment USA",Nomad,Manga,24 min per ep,PG-13 - Teens 13 or older,2053,1120,1936,https://cdn.myanimelist.net/images/anime/1424/108431.jpg
47,Rozen Maiden: Träumend,Rozen Maiden: Träumend,ローゼンメイデン トロイメント,7.62,"Action, Comedy, Drama","As the story of Rozen Maiden closes, a new chapter begins in Rozen Maiden: Träumend. Shinku and the other sentient dolls of the Rozen Maiden collection are living life as usual at Jun Sakurada's house. Having settled into his role as Shinku's partner in the deadly Alice Game, Jun overcomes his former fears and prepares to return to school. And although Shinku and the other dolls idly pass the days by in the comfort of Jun's home, dark times lie ahead as a new foe presents herself: Barasuishou, the seventh Rozen Maiden.

But Barasuishou is a mystery even to her sisters, none of whom have ever laid eyes on her until now. Shinku considers this a sign that the Alice Game is coming to an end, meaning the dolls will soon be forced to fight one another. Haunted by the upcoming battle and nightmares concerning another doll, Shinku begins distancing herself from the others. If she wishes to claim victory, it will come at a high cost—the lives of her sisters.",TV,12,"Oct 21, 2005 to Jan 27, 2006",Finished Airing,"Mellow Head, TBS","Sentai Filmworks, Geneon Entertainment USA",Nomad,Manga,24 min per ep,PG-13 - Teens 13 or older,1340,1898,450,https://cdn.myanimelist.net/images/anime/4/10242.jpg
48,Azumanga Daiou The Animation,Azumanga Daioh: The Animation,あずまんが大王 THE ANIMATION,7.99,"Comedy, Slice of Life","Chiyo Mihama begins her high school career as one of the strangest students in her freshman class—a tiny, 10-year-old academic prodigy with a fondness for plush dolls and homemade cooking. But her homeroom teacher, Yukari Tanizaki, is the kind of person who would hijack a student's bike to avoid being late, so ""strange"" is a relative word.

There certainly isn't a shortage of peculiar girls in Yukari-sensei's homeroom class. Accompanying Chiyo are students like Tomo Takino, an energetic tomboy with more enthusiasm than brains; Koyomi Mizuhara, Tomo's best friend whose temper has a fuse shorter than Chiyo; and Sakaki, a tall, athletic beauty whose intimidating looks hide a gentle personality and a painful obsession with cats. In addition, transfer student Ayumu Kasuga, a girl with her head stuck in the clouds, fits right in with the rest of the girls—and she has a few interesting theories about Chiyo's pigtails!

Together, this lovable group of girls experience the ups and downs of school life, their many adventures filled with constant laughter, surreal absurdity, and occasionally even touching commentary on the bittersweet, temporal nature of high school.",TV,26,"Apr 9, 2002 to Oct 1, 2002",Finished Airing,"Genco, Lantis, Imagica, TV Tokyo Music, Cosmic Ray, King Records","ADV Films, Sentai Filmworks",J.C.Staff,4-koma manga,24 min per ep,PG-13 - Teens 13 or older,603,668,6327,https://cdn.myanimelist.net/images/anime/1066/117358.jpg
49,Basilisk: Kouga Ninpou Chou,Basilisk,バジリスク 甲賀忍法帖,7.55,"Action, Drama, Romance","For centuries, the Iga and Kouga ninja clans have engaged in a bitter war. But when a ceasefire is ordered by the powerful warlord Ieyasu Tokugawa, the two clans are forced to put down their arms.

Years later, Gennosuke Kouga, heir of the Kouga clan, and Oboro Iga, heir of the Iga clan, have fallen in love. Through marriage, both heirs aim to bring peace to the clans. But their hopes are dashed when flames of rivalry between their clans are reignited, and they are dragged into another war.

Ieyasu's two grandsons have both claimed to be the next heir to the shogunate. To resolve this dispute, both the Kouga and Iga are ordered to send their 10 best warriors to fight in a bloody battle royale, with each clan representing one of the potential shogunate heirs. Two scrolls with the names of the fighters are given and are to be marked in blood upon the given fighter's death. The prize for winning is the favor of the Tokugawa shogunate for a thousand years. Torn between their love for each other and duty to their clans, Gennosuke and Oboro must ultimately decide the fate of their clans.",TV,24,"Apr 13, 2005 to Sep 21, 2005",Finished Airing,"GDH, Kodansha, Sotsu Music Publishing",Funimation,Gonzo,Manga,24 min per ep,R - 17+ (violence & profanity),1539,1213,1371,https://cdn.myanimelist.net/images/anime/1103/133549.jpg
50,Black Cat (TV),Black Cat,ブラックキャット,7.33,"Action, Adventure, Sci-Fi","Completing every job with ruthless accuracy, Train Heartnet is an infamous assassin with no regard for human life. Donning the moniker ""Black Cat"" in the underground world, the elite killer works for the powerful secret organization known only as Chronos.

One gloomy night, the blasé gunman stumbles upon Saya Minatsuki, an enigmatic bounty hunter, and soon develops an odd friendship with her. Influenced by Saya's positive outlook on life, Train begins to rethink his life. Deciding to abandon his role as the Black Cat, he instead opts to head down a virtuous path as an honest bounty hunter. However, Chronos—and particularly Creed Diskenth, Train's possessive underling—is not impressed with Train's sudden change of heart and vows to resort to extreme measures in order to bring back the emissary of bad luck.

This assassin turned ""stray cat"" can only wander so far before the deafening sound of gunfire rings out.",TV,23,"Oct 7, 2005 to Mar 31, 2006",Finished Airing,"GDH, Dentsu, TBS, Sotsu Music Publishing",Funimation,Gonzo,Manga,24 min per ep,PG-13 - Teens 13 or older,2389,846,1779,https://cdn.myanimelist.net/images/anime/1183/133280.jpg
51,Cluster Edge,UNKNOWN,CLUSTER EDGE（クラスターエッジ）,6.31,"Action, Fantasy, Sci-Fi","Cluster Edge Academy isn't just any school; it's THE school, where the offspring of the elite come together to prepare for their roles running a world where artificial soldiers and religious sects are major factors in the battle for total control. Which may be part of why new transfer student Agate Fluorite doesn't quite seem to fit in. It's not just that Agate's enthusiastic attitude stands out among the somber, brooding balance of the student body. There's something about him that demands notice, even from jaded honors students like Beryl Jasper, and from the moment of arrival he's been at the center of a series of mysteries that not even Agate understands. Because Agate's not just another student, he's part of a something so momentous, and dangerous, that the world that built Cluster Edge may not survive its passing.

(Source: Sentai Filmworks)",TV,25,"Oct 5, 2005 to Mar 29, 2006",Finished Airing,"Bandai Visual, Imagine",Sentai Filmworks,Sunrise,Original,24 min per ep,PG-13 - Teens 13 or older,7357,5917,13,https://cdn.myanimelist.net/images/anime/1980/103243.jpg
52,Full Metal Panic!,Full Metal Panic!,フルメタル・パニック！,7.61,"Action, Comedy, Sci-Fi","Mithril, a covert military institution using state-of-the-art technology to combat terrorist operations, assigns a specialized team to a sensitive mission. Under the command of superior officer Melissa Mao, sergeants Sousuke Sagara and Kurz Weber must secretly protect Kaname Chidori—a teenage girl who unconsciously holds breakthrough scientific knowledge and is considered a ""Whispered""—from intelligence agencies and other organizations pursuing her abilities.

While Kurz and Melissa are to assist him remotely, Sousuke enrolls at Kaname's high school as one of her classmates to closely monitor her. However, his militaristic upbringing and poor social skills lead to a difficult adjustment to civilian life. Not only does he attract unnecessary attention, but his actions frequently make Kaname suspicious of him.

Despite the earnest attempts to fulfill his duty, a terrorist ambush further complicates Sousuke's task. Recognizing the vicious mastermind behind the assault, Sousuke abandons his orders to ensure Kaname's safety.",TV,24,"Jan 8, 2002 to Jun 18, 2002",Finished Airing,"Kadokawa Shoten, KlockWorx","ADV Films, Funimation",Gonzo,Light novel,24 min per ep,R - 17+ (violence & profanity),1356,422,4326,https://cdn.myanimelist.net/images/anime/2/75259.jpg
53,Full Metal Panic? Fumoffu,Full Metal Panic? Fumoffu,フルメタル・パニック? ふもっふ,8.03,"Action, Comedy","Sergeant Sousuke Sagara returns to Jindai High School to protect the precious war asset, Kaname Chidori, from any threat. However, his lack of social skills and real-life experience result in comical yet dangerous situations, endangering the peaceful school life Kaname longs for. As Sousuke continues to bring a wide range of weapons to school as a means to solve threats—real or fake—Kaname struggles to fulfill her duty as the student council vice president all while keeping him in check.

To ensure a successful mission, Sousuke is occasionally forced to use the costume of a famous amusement park mascot called Bonta-kun. With his technical expertise, he eventually transforms the exuberant uniform into a cutting-edge exoskeleton that has only one dysfunction: the voice translator can only produce the sound ""mofu.""

Full Metal Panic? Fumoffu depicts the adventures of Kaname and Sousuke as they try to live their normal school lives despite the chaos they inadvertently cause.",TV,12,"Aug 26, 2003 to Nov 18, 2003",Finished Airing,"Tatsunoko Production, Kadokawa Shoten, Fuji TV, Imagica, Rakuonsha, Kadokawa Pictures Japan, KlockWorx, Happinet Pictures, Animation Do","ADV Films, Funimation",Kyoto Animation,Light novel,24 min per ep,PG-13 - Teens 13 or older,548,769,2907,https://cdn.myanimelist.net/images/anime/4/75260.jpg
54,Full Metal Panic! The Second Raid,Full Metal Panic! The Second Raid,フルメタル パニック！The Second Raid,7.93,Action,"After overcoming various tumultuous events, mercenary sergeant Sousuke Sagara of Mithril and ""Whispered"" school girl Kaname Chidori return to their normal high school lives. Sousuke continues his efforts to assimilate with the civilian population and manage his mission at the same time, while Kaname attempts to support his endeavors (even though his antics often drive her up a wall).

However, as their lives calm, new problems begin to appear. The appearance of an independent terrorist organization  known as Amalgam and internal conflicts within Mithril threaten to wreak unity into a series of failures and betrayals. And new, powerful Arm Slave models only worsen the situation when the world's peace is at stake.

As Kaname and Sousuke face their own inner battles amidst life-threatening fights, will they be able to make the right choices and change their future?",TV,13,"Jul 14, 2005 to Oct 20, 2005",Finished Airing,"WOWOW, Kadokawa Shoten, KlockWorx, Happinet Pictures","ADV Films, Funimation, Kadokawa Pictures USA",Kyoto Animation,Light novel,24 min per ep,R - 17+ (violence & profanity),682,878,1268,https://cdn.myanimelist.net/images/anime/11/75261.jpg
55,Gakuen Alice,Gakuen Alice,学園アリス,7.64,"Comedy, Fantasy","Mikan Sakura is a normal 10-year-old girl. Optimistic, energetic, and overall a very sweet child, Mikan is the complete opposite of the aloof, intelligent, and somewhat cold-hearted, Hotaru Imai. Despite their glaring differences, the two girls have been best friends for a very long time. So when Hotaru suddenly transfers to Alice Academy, a prestigious school in the city, her best friend is devastated—especially when she hears of the horrible rumors regarding the academy's harsh treatment of students. Beset with worry, Mikan runs away to see her best friend!

Upon her arrival, Mikan learns of ""Alices,"" individuals gifted with various supernatural abilities, and that the school is an institution built by the government to train and protect them. Discovering that she has her own unique powers, Mikan enrolls in the academy, and, after a lot of trouble, finally reunites with Hotaru.

Gakuen Alice is a heartwarming comedy that follows Mikan and her friends' adventures in the academy, as well as their attempt to uncover the mysteries surrounding the problematic, fire-wielding student Natsume Hyuuga.",TV,26,"Oct 30, 2004 to May 14, 2005",Finished Airing,"Aniplex, Sogo Vision",Nozomi Entertainment,Group TAC,Manga,25 min per ep,G - All Ages,1276,1975,1397,https://cdn.myanimelist.net/images/anime/4/18118.jpg
56,Soukyuu no Fafner: Dead Aggressor,Fafner,蒼穹のファフナーDead Aggressor,7.26,"Action, Drama, Sci-Fi","Tatsumiyajima is the central island in the middle of a small cluster of islands, in a sleepy backwater of the Japanese isles. Not much happens there, and the island's young people go to school knowing that their lives are likely to remain peaceful and undisturbed. Or so they have been taught... but the truth is different. The fate of mankind is on the line, and Tatsumiyajima is the last line of defense against a hostile and incomprehensible enemy. At the center of it all, fighting for Humanity's continued existence, is the giant robot Fafner, the dragon that guards this final treasure of mankind.

(Source: ANN)",TV,25,"Jul 5, 2004 to Dec 27, 2004",Finished Airing,"TV Tokyo Music, King Records","Funimation, Geneon Entertainment USA",Xebec,Original,24 min per ep,PG-13 - Teens 13 or older,2751,3000,260,https://cdn.myanimelist.net/images/anime/3/50365.jpg
57,Mahou Shoujo Lyrical Nanoha,Magical Girl Lyrical Nanoha,魔法少女リリカルなのは,7.41,"Action, Comedy, Drama","Nanoha Takamachi, an ordinary third-grader who enjoys spending time with her family and friends, rescues an injured ferret that she had dreamed about the night before. The next day, the ferret cries out to her telepathically, asking Nanoha to save him. The ferret reveals himself to be Yuuno Scrya, a mage from another world who is trying to collect the dangerous 21 Jewel Seeds that he accidentally scattered across the world. He enlists Nanoha's help, gifting her the magical wand Raising Heart, and teaches her how to become a powerful mage.

Days later, after reclaiming a few of the Jewel Seeds, another mage appears: Fate Testarossa. Stronger than Nanoha, Fate refuses to divulge her reasons in trying to collect the Jewel Seeds. Nanoha senses a melancholy in her eyes, but Fate refuses to communicate. Directed by Akiyuki Shinbo, Mahou Shoujo Lyrical Nanoha is a story about the clash of emotions when goals collide.",TV,13,"Oct 3, 2004 to Dec 26, 2004",Finished Airing,"Starchild Records, Omnibus Japan",Geneon Entertainment USA,Seven Arcs,Original,25 min per ep,PG-13 - Teens 13 or older,2044,1921,1038,https://cdn.myanimelist.net/images/anime/1052/136283.jpg
58,Mahou Shoujo Lyrical Nanoha A's,Magical Girl Lyrical Nanoha A's,魔法少女リリカルなのは エース,7.97,"Action, Comedy, Drama","After solving the incident of the scattered Jewel Seeds, Nanoha Takamachi happily returns to her everyday life, though now with added magic practice in the morning. Exchanging video messages with Fate Testarossa and the crew of the Arthra, Nanoha eagerly awaits the chance to speak with them in person again. But while studying in her room one day, Raising Heart suddenly calls out to Nanoha and warns her of an incoming attack!

The attacker is a young girl named Vita, who calls herself a Belka Knight. She proves her strength by using an intelligent device with a mysterious cartridge system to quickly overwhelm Nanoha. Luckily, the Space-Time Administration Bureau is able to step in before she is completely crushed. Vita and her fellow knights Shamal, Signum, and Zafila are on a mission to steal magical power from mages in order to complete the Book of Darkness, one of the Lost Logia. For what sinister purpose are the knights after this Book of Darkness?",TV,13,"Oct 2, 2005 to Dec 25, 2005",Finished Airing,"Starchild Records, Omnibus Japan",Geneon Entertainment USA,Seven Arcs,Original,25 min per ep,PG-13 - Teens 13 or older,622,2555,993,https://cdn.myanimelist.net/images/anime/4/6767.jpg
59,Shuffle!,Shuffle!,SHUFFLE! (シャッフル!),7.03,"Comedy, Drama, Fantasy, Romance, Ecchi","In present times, Gods and Demons coexist together with Humans after the door between each of these worlds had opened. Tsuchimi Rin is a normal young high school student attending Verbena Academy, spending his days living peacefully with his childhood friend Kaede. Unexpectedly, one day the King of Gods, the King of Demons and their families move into be Rin's next door neighbors. Apparently the daughter of the Gods, Sia, and the daughter of the demons, Nerine, are both deeply in love with Rin after having met him in the past. Along with his playful friendship with upperclassmen Asa and his encounter with the silent but cute Primula, Rin has much on his hands dealing with the affections of each of these girls. Based on the eroge by Navel.",TV,24,"Jul 8, 2005 to Jan 6, 2006",Finished Airing,"Xebec, Lantis, Kadokawa Shoten, KlockWorx, Memory-Tech",Funimation,asread.,Visual novel,24 min per ep,R+ - Mild Nudity,3854,820,1461,https://cdn.myanimelist.net/images/anime/1290/133860.jpg
60,Kidou Senshi Gundam,Mobile Suit Gundam,機動戦士ガンダム,7.76,"Action, Drama, Sci-Fi","It is year 0079 of the Universal Century. Mankind has moved to space, living in colony clusters known as ""Sides."" One of these Sides declares itself the ""Principality of Zeon"" and declares war on the Earth Federation, the governmental body currently ruling Earth. Using powerful humanoid robots known as ""mobile suits,"" Zeon quickly gains the upper hand.

Nine months into the conflict, the Earth Federation has developed its own powerful mobile suit called the Gundam. When Zeon launches an attack on the colony holding the Gundam, a 15-year-old civilian named Amuro Ray suddenly finds himself thrown into a conflict that will take him all across Earth and space, pitting him against the enemy's ace pilot, Char Aznable.",TV,43,"Apr 7, 1979 to Jan 26, 1980",Finished Airing,"Sotsu, Nagoya Broadcasting Network","Nozomi Entertainment, Bandai Entertainment",Sunrise,Original,25 min per ep,PG-13 - Teens 13 or older,1005,1632,2140,https://cdn.myanimelist.net/images/anime/5/88524.jpg
61,Kidou Senshi Gundam: Dai 08 MS Shoutai,Mobile Suit Gundam: The 08th MS Team,機動戦士ガンダム 第08MS小隊,8.01,"Adventure, Drama, Romance, Sci-Fi","In year 0079 of the Universal Century, the Earth Federation initiates Operation Odessa—a full-scale assault to retake a major Ukrainian city from the Principality of Zeon. It is a success, and the remaining Zeon forces scatter across the globe. The Earth Federation gains the upper hand in the One Year War and deploys its ground troops around the planet to hunt down the stragglers.

As part of the deployments, Ensign Shiro Amada is transferred to Southeast Asia to take command of the 08th MS Team—a special squadron of RX-79 Gundam Ground Type pilots. In their first guerilla operation, Shiro's team is tasked with distracting the Zeon forces while Federation ground troops locate a mysterious new Zeon weapon. Everything goes according to plan until Shiro runs into Aina Sahalin, an ace Zeon pilot he met in an earlier battle, during a skirmish. Their reunion weakens his resolve to continue fighting, and now the young commander Shiro must prove his loyalty to the Federation—or be branded a traitor.",OVA,12,"Jan 25, 1996 to Jul 25, 1999",Finished Airing,Atelier Musa,Bandai Entertainment,Sunrise,Original,25 min per ep,PG-13 - Teens 13 or older,571,2231,1064,https://cdn.myanimelist.net/images/anime/9/75618.jpg
